{
  "title": "Notion API — Create a page",
  "summary": "Documentation officielle pour créer une page dans une base Notion via l'API.",
  "category": "API",
  "status": "Published",
  "url": "https://developers.notion.com/reference/post-page",
  "source": "Notion Developers",
  "tags": ["notion", "api", "reference"]
}
